Reviews of Management Sciences	admin	https://rmsjournal.com/index.php/admin/oai	PDF
AFEBI Economic and Finance Review	aefr	https://journal.afebi.org/index.php/aefr/oai	PDF
Journal of Accounting and Investment	ai	http://journal.umy.ac.id/index.php/ai/oai	PDF
Agora International Journal of Economical Sciences	aijes	http://univagora.ro/jour/index.php/aijes/oai	PDF
African Journal of Career Development	ajcd	https://ajcd.africa/index.php/ajcd/oai	PDF
African Journal of Disability	ajod	https://ajod.org/index.php/ajod/oai	PDF
African Journal of Social Work	ajsw	https://www.ajol.info/index.php/ajsw/oai	PDF
AFEBI Management and Business Review	ambr	http://journal.afebi.org/index.php/ambr/oai	PDF
Asia Pacific Public Relations Journal	apprj	http://novaojs.newcastle.edu.au/apprj/index.php/apprj/oai	PDF
Australian Population Studies	aps	https://www.australianpopulationstudies.org/index.php/aps/oai	PDF
Alternate routes: a journal of Critical Social Research	ar	http://www.alternateroutes.ca/index.php/ar/oai	PDF
Aresty Rutgers Undergraduate Research Journal	arestyrurj	https://arestyrurj.libraries.rutgers.edu/index.php/arestyrurj/oai	PDF
Zeszyty Naukowe Wyższej Szkoły Finansów i Prawa w Bielsku-Białej	asej	https://asej.eu/index.php/asej/oai	PDF
Advances in Social Work	asw	http://journals.iupui.edu/index.php/advancesinsocialwork/oai	PDF
Business and Finance Journal	bfj	https://journal2.unusa.ac.id/index.php/BFJ/oai	PDF
Business, Management and Economics Engineering	bmee	https://journals.vilniustech.lt/index.php/BMEE/oai	PDF
Caste	caste	https://journals.library.brandeis.edu/index.php/caste/oai	PDF
Copernican Journal of Finance & Accounting	cjfa	http://apcz.umk.pl/czasopisma/index.php/CJFA/oai	PDF
Comparative Population Studies	cpos	https://www.comparativepopulationstudies.de/index.php/CPoS/oai	PDF
Changing Societies & Personalities	csp	https://changing-sp.com/ojs/index.php/csp/oai	PDF
International Journal of Research In Business and Social Science	current	http://www.ssbfnet.com/ojs/index.php/ijrbs/issue/current/oai	PDF
Dynamic Econometric Models	dem	http://apcz.umk.pl/czasopisma/index.php/DEM/oai	PDF
Discern	discernj	https://www.designforsocialchange.org/journal/index.php/DISCERN-J/oai	PDF
Economic Analysis	ea	http://www.library.ien.bg.ac.rs/index.php/ea/oai	PDF
Economy and Sociology	eas	https://es.ince.md/index.php/Economy_and_Sociology/oai	PDF
Ho Chi Minh City Open University Journal of Science - Economics and Business Administration	econen	https://journalofscience.ou.edu.vn/index.php/econ-en/oai	PDF
European Journal of Spatial Development	ejsd	https://journals.polito.it/index.php/EJSD/oai	PDF
European Journal of Social Impact and Circular Economy	ejsice	https://www.ojs.unito.it/index.php/ejsice/oai	PDF
Jurnal Ekonomi & Studi Pembangunan	esp	https://journal.umy.ac.id/index.php/esp/oai	PDF
Revista Colombiana de Estadística	estad	https://revistas.unal.edu.co/index.php/estad/oai	PDF
Finance, Accounting and Business Analysis	faba	http://faba.bg/index.php/faba/oai	PDF
Sinergi: Jurnal Ilmiah Ilmu Manajemen	feb	http://ejournal.unitomo.ac.id/index.php/feb/oai	PDF
Journal of Applied Economics and Business Studies	files	https://pepri.edu.pk/jaebs/index.php/files/oai	PDF
Facta Universitatis. Series: Economics and Organization	fueconorg	http://casopisi.junis.ni.ac.rs/index.php/FUEconOrg/oai	PDF
Gusau Journal of Accounting and Finance	gujaf	https://journals.gujaf.com.ng/index.php/gujaf/oai	PDF
HighTech and Innovation Journal	hij	https://hightechjournal.org/index.php/HIJ/oai	PDF
Human Rights Education Review	human	https://journals.oslomet.no/index.php/human/oai	PDF
International Business and Accounting Research Journal	ibarj	http://ibarj.com/index.php/ibarj/oai	PDF
International Conference on Economics, Education, Business, and Accounting	iceeba	http://iceeba.unnes.ac.id/proceeding/index.php/iceeba/oai	PDF
DIJB (Diponegoro International Journal of Business)	ijb	https://ejournal2.undip.ac.id/index.php/ijb/oai	PDF
International Journal of Business Administration and Management Research	ijbamr	http://researchplusjournals.com/index.php/IJBAMR/oai	PDF
International Journal of Banking and Finance	ijbf	http://e-journal.uum.edu.my/index.php/ijbf/oai	PDF
International Journal of Business Reflections	ijbr	http://journals.pu.edu.pk/journals/index.php/ijbr/oai	PDF
International Journal of Commerce and Finance	ijcf	http://ijcf.ticaret.edu.tr/index.php/ijcf/oai	PDF
Gateways	ijcre	http://epress.lib.uts.edu.au/journals/index.php/ijcre/oai	PDF
Journal of Contemporary Urban Affairs	ijcua	https://www.ijcua.com/index.php/ijcua/oai	PDF
International Journal of Child, Youth & Family Studies	ijcyfs	http://journals.uvic.ca/index.php/ijcyfs/oai	PDF
International Journal of Energetica	ijeca	https://www.ijeca.info/index.php/IJECA/oai	PDF
International Journal of Economics and Financial Issues	ijefi	http://www.econjournals.com/index.php/ijefi/oai	PDF
IJHCM: International Journal of Human Capital Management	ijhcm	http://journal.unj.ac.id/unj/index.php/ijhcm/oai	PDF
International Journal of Islamic Business and Economics (IJIBEC)	ijibec	http://e-journal.iainpekalongan.ac.id/index.php/IJIBEC/oai	PDF
International Journal of Islamic Economics and Finance	ijief	http://journal.umy.ac.id/index.php/ijief/oai	PDF
International Journal of Management, Entrepreneurship, Social Science and Humanities (IJMESH)	ijmesh	http://journals.researchsynergypress.com/index.php/ijmesh/oai	PDF
Indonesian Journal of Social Research	ijsr	http://iojs.unida.ac.id/index.php/IJSR/oai	PDF
Ilomata International Journal of Tax and Accounting	ijtc	https://www.ilomata.org/index.php/ijtc/oai	PDF
International Review of Management and Marketing	irmm	https://econjournals.com/index.php/irmm/oai	PDF
Issues in Social and Environmental Accounting	isea	http://isea.icseard.uns.ac.id/index.php/isea/oai	PDF
Baltic Journal of Economic Studies	issue	http://www.baltijapublishing.lv/index.php/issue/oai	PDF
JABE (Journal of Accounting and Business Education)	jabe	http://journal2.um.ac.id/index.php/jabe/oai	PDF
Jurnal Akuntansi, Manajemen dan Ekonomi	jame	http://jos.unsoed.ac.id/index.php/jame/oai	PDF
Journal of Asian Rural Studies	jars	http://pasca.unhas.ac.id/ojs/index.php/jars/oai	PDF
Journal of Asian Social Science Research	jassr	https://cassr.net/jassr/index.php/jassr/oai	PDF
Journal of Applied Sciences in Travel and Hospitality	jasth	http://ojs.pnb.ac.id/index.php/JASTH/oai	PDF
Journal of Business Strategies	jbs	https://jbs-ojs-shsu.tdl.org/jbs/index.php/jbs/oai	PDF
Journal of Construction Business and Management	jcbm	https://journals.uct.ac.za/index.php/jcbm/oai	PDF
Journal of Comparative Social Work	jcsw	https://journals.uis.no/index.php/JCSW/oai	PDF
Jema: Jurnal Ilmiah Bidang Akuntansi dan Manajemen	jema	http://riset.unisma.ac.id/index.php/jema/oai	PDF
Journal of Evolutionary Studies in Business	jesb	http://revistes.ub.edu/index.php/JESB/oai	PDF
Journal for Economic Educators	jfee	https://libjournals.mtsu.edu/index.php/jfee/oai	PDF
Journal of Family Research	jfr	https://ubp.uni-bamberg.de/jfr/index.php/jfr/oai	PDF
Journal of Governance Risk Management Compliance and Sustainability	jgrcs	https://journals.researchsynergypress.com/index.php/jgrcs/oai	PDF
Journal of Innovation Management	jim	https://journalsojs3.fe.up.pt/index.php/jim/oai	PDF
Journal of Islamic Economic Laws	jisel	http://journals.ums.ac.id/index.php/jisel/oai	PDF
Journal of Intelligence Studies in Business	jisib	https://ojs.hh.se/index.php/JISIB/oai	PDF
Journal of International Trade, Logistics and Law	jital	http://jital.org/index.php/jital/oai	PDF
JMSNI (Journal of Maritime Studies and National Integration)	jmsni	https://ejournal2.undip.ac.id/index.php/jmsni/oai	PDF
Journal of Business and Behavioural Entrepreneurship	jobbe	http://journal.unj.ac.id/unj/index.php/jobbe/oai	PDF
Journal of Business Models	jobm	https://journals.aau.dk/index.php/JOBM/oai	PDF
Iraqi Journal of Industrial Research	jou	http://ijoir.gov.iq/ijoir/index.php/jou/oai	PDF
JPAIR	jpair	https://philair.ph/index.php/jpair/oai	PDF
Journal of Small Business Strategy	jsbs	http://libjournals.mtsu.edu/index.php/jsbs/oai	PDF
Journal of Social Studies	jss	https://journal.uny.ac.id/index.php/jss/oai	PDF
Journal of Social Science	jsss	https://jsss.co.id/index.php/jsss/oai	PDF
Jurnal Akuntansi	jurnalakuntansi	https://ejournal.unib.ac.id/index.php/JurnalAkuntansi/oai	PDF
Journal of Women's Entrepreneurship and Education	jwee	https://www.library.ien.bg.ac.rs/index.php/jwee/oai	PDF
Cosmopolitan Civil Societies: An Interdisciplinary Journal	mcs	https://epress.lib.uts.edu.au/journals/index.php/mcs/oai	PDF
مجلة بحوث الإدارة والاقتصاد	merj	https://mer-j.com/merj/index.php/merj/oai	PDF
M@n@gement	mgmt	https://management-aims.com/index.php/mgmt/oai	PDF
Management	mng	http://management.fon.bg.ac.rs/index.php/mng/oai	PDF
Nordic Journal of Social Research	njsr	https://journals.oslomet.no/index.php/njsr/oai	PDF
Organisational Project Management	opm	http://epress.lib.uts.edu.au/journals/index.php/opm/oai	PDF
Public Governance, Administration and Finances Law Review	pgaf	https://folyoirat.ludovika.hu/index.php/pgaf/oai	PDF
International Entrepreneurship Review	pm	https://ier.uek.krakow.pl/index.php/pm/oai	PDF
Project Management Research and Practice	pmrp	http://epress.lib.uts.edu.au/journals/index.php/pmrp/oai	PDF
DIEM	proceedings	http://www.diem-dubrovnik.com/diem/index.php/diem/index/pages/view/proceedings/oai	PDF
Prizren Social Science Journal	pssj	http://prizrenjournal.com/index.php/PSSJ/oai	PDF
Qualitative Studies	qual	http://ojs.statsbiblioteket.dk/index.php/qual/oai	PDF
Review of Economics and Development Studies	reads	http://reads.spcrd.org/index.php/reads/oai	PDF
R-Economy	reconomy	https://journals.urfu.ru/index.php/r-economy/oai	PDF
Research in Urbanism Series	rius	https://www.rius.ac/index.php/rius/oai	PDF
South Asian Review of Business and Administrative Studies	sabas	https://journals.iub.edu.pk/index.php/sabas/oai	PDF
Southern African Business Review	sabr	https://unisapressjournals.co.za/index.php/SABR/oai	PDF
South African Journal of Economic and Management Sciences	sajems	https://sajems.org/index.php/sajems/oai	PDF
The Southern African Journal of Entrepreneurship and Small Business Management	sajesbm	https://sajesbm.co.za/index.php/sajesbm/oai	PDF
SA Journal of Human Resource Management	sajhrm	https://sajhrm.co.za/index.php/sajhrm/oai	PDF
SA Journal of Industrial Psychology	sajip	https://sajip.co.za/index.php/sajip/oai	PDF
Surveillance & Society	sas	https://ojs.library.queensu.ca/index.php/surveillance-and-society/oai	PDF
Studies and Scientific Researches: Economics Edition	sceco	http://sceco.ub.ro/index.php/SCECO/oai	PDF
The Spirit of Society Journal: International Journal of Society Development and Engagement	scj	http://jurnal.narotama.ac.id/index.php/scj/oai	PDF
Salasika	sj	http://salasika.org/index.php/SJ/oai	PDF
Ho Chi Minh City Open University Journal of Science - Social Sciences	socien	https://journalofscience.ou.edu.vn/index.php/soci-en/oai	PDF
Tạp chí Khoa học Đại học Mở Thành phố Hồ Chí Minh - Khoa học Xã hội	socivi	https://journalofscience.ou.edu.vn/index.php/soci-vi/oai	PDF
Studies in Social Justice	ssj	https://journals.library.brocku.ca/index.php/SSJ/oai	PDF
The Thinker	thethinker	https://journals.uj.ac.za/index.php/The_Thinker/oai	PDF
Three Seas Economic Journal	threeseas	http://www.baltijapublishing.lv/index.php/threeseas/oai	PDF
Transcultural Studies	transcultural	https://heiup.uni-heidelberg.de/journals/index.php/transcultural/oai	PDF
Undergraduate Journal of Service Learning and Community-Based Research	ujslcbr	https://ujslcbr.org/index.php/ujslcbr/oai	PDF
UKH Journal of Social Sciences	ukhjss	https://journals.ukh.edu.krd/index.php/ukhjss/oai	PDF
Wine Economics and Policy	wep	https://oaj.fupress.net/index.php/wep/oai	PDF
Journal the Winners	winners	https://journal.binus.ac.id/index.php/winners/oai	PDF
